{
  "version": "1.0",
  "metadata": {
    "name": "E-Commerce Complete Flow",
    "description": "Complete order placement flow across all 7 domains: UI → BFF → Orders → Inventory/Payment (parallel) → Shipping → Notifications",
    "generated": "2025-11-21T22:25:00Z",
    "sources": [
      {
        "repository": "ecommerce-demo-app",
        "extractedAt": "2025-11-21T22:25:00Z"
      }
    ],
    "domains": {
      "ui": {
        "description": "User interface presentation layer",
        "systemType": "ui"
      },
      "bff": {
        "description": "Backend-for-frontend orchestration layer",
        "systemType": "bff"
      },
      "orders": {
        "description": "Order lifecycle management - placement, fulfillment, cancellation",
        "systemType": "domain",
        "entities": {
          "Order": {
            "description": "Aggregate root tracking order lifecycle from placement through delivery or cancellation",
            "stateMachine": {
              "states": [
                "Draft",
                "Placed",
                "Confirmed",
                "Shipped",
                "Delivered",
                "Cancelled"
              ],
              "initialState": "Draft",
              "terminalStates": [
                "Delivered",
                "Cancelled"
              ],
              "transitions": [
                {
                  "from": "Draft",
                  "to": "Placed",
                  "trigger": "begin"
                },
                {
                  "from": "Placed",
                  "to": "Confirmed",
                  "trigger": "confirm"
                },
                {
                  "from": "Confirmed",
                  "to": "Shipped",
                  "trigger": "ship"
                },
                {
                  "from": "Shipped",
                  "to": "Delivered",
                  "trigger": "deliver"
                },
                {
                  "from": "*",
                  "to": "Cancelled",
                  "trigger": "cancel"
                }
              ]
            },
            "invariants": [
              "Order must have at least one item",
              "Total amount must be positive",
              "Cannot ship without inventory reserved",
              "Cannot confirm without payment authorized"
            ],
            "dataShape": {
              "fields": [
                {
                  "name": "orderId",
                  "type": "string",
                  "required": true,
                  "description": "Unique order identifier"
                },
                {
                  "name": "customerId",
                  "type": "string",
                  "required": true,
                  "description": "Customer placing the order"
                },
                {
                  "name": "items",
                  "type": "OrderItem[]",
                  "required": true,
                  "description": "Line items in the order"
                },
                {
                  "name": "total",
                  "type": "number",
                  "required": true,
                  "description": "Total order amount"
                },
                {
                  "name": "state",
                  "type": "OrderState",
                  "required": true,
                  "description": "Current order state"
                },
                {
                  "name": "placedAt",
                  "type": "DateTime",
                  "required": false,
                  "description": "When order was placed"
                },
                {
                  "name": "shippedAt",
                  "type": "DateTime",
                  "required": false,
                  "description": "When order was shipped"
                }
              ]
            }
          }
        }
      },
      "inventory": {
        "description": "Stock reservation and inventory management",
        "systemType": "domain",
        "entities": {
          "InventoryItem": {
            "description": "Tracks stock levels through reservation, allocation, and release cycles",
            "stateMachine": {
              "states": [
                "Available",
                "PartiallyReserved",
                "FullyReserved",
                "Allocated",
                "Released"
              ],
              "initialState": "Available",
              "terminalStates": [
                "Released"
              ],
              "transitions": [
                {
                  "from": "Available",
                  "to": "PartiallyReserved",
                  "trigger": "reserve"
                },
                {
                  "from": "PartiallyReserved",
                  "to": "FullyReserved",
                  "trigger": "reserve"
                },
                {
                  "from": "FullyReserved",
                  "to": "Allocated",
                  "trigger": "allocate"
                },
                {
                  "from": "PartiallyReserved",
                  "to": "Released",
                  "trigger": "release"
                },
                {
                  "from": "Allocated",
                  "to": "Released",
                  "trigger": "release"
                }
              ]
            },
            "invariants": [
              "Quantity on hand must be non-negative",
              "Reserved quantity cannot exceed on hand",
              "Allocated quantity cannot exceed reserved"
            ],
            "dataShape": {
              "fields": [
                {
                  "name": "itemId",
                  "type": "string",
                  "required": true,
                  "description": "Product/SKU identifier"
                },
                {
                  "name": "onHand",
                  "type": "number",
                  "required": true,
                  "description": "Total units available"
                },
                {
                  "name": "reserved",
                  "type": "number",
                  "required": true,
                  "description": "Units reserved for orders"
                },
                {
                  "name": "allocated",
                  "type": "number",
                  "required": true,
                  "description": "Units allocated for shipment"
                },
                {
                  "name": "state",
                  "type": "InventoryState",
                  "required": true,
                  "description": "Current inventory state"
                }
              ]
            }
          }
        }
      },
      "payment": {
        "description": "Payment processing and transaction management",
        "systemType": "domain",
        "entities": {
          "Payment": {
            "description": "Manages payment authorization, capture, failure, and refund lifecycle",
            "stateMachine": {
              "states": [
                "Pending",
                "Authorized",
                "Captured",
                "Failed",
                "Refunded"
              ],
              "initialState": "Pending",
              "terminalStates": [
                "Captured",
                "Failed",
                "Refunded"
              ],
              "transitions": [
                {
                  "from": "Pending",
                  "to": "Authorized",
                  "trigger": "authorize"
                },
                {
                  "from": "Authorized",
                  "to": "Captured",
                  "trigger": "capture"
                },
                {
                  "from": "Pending",
                  "to": "Failed",
                  "trigger": "fail"
                },
                {
                  "from": "Authorized",
                  "to": "Failed",
                  "trigger": "fail"
                },
                {
                  "from": "Captured",
                  "to": "Refunded",
                  "trigger": "refund"
                }
              ]
            },
            "invariants": [
              "Amount must be positive",
              "Only one active payment per order",
              "Cannot refund more than captured"
            ],
            "dataShape": {
              "fields": [
                {
                  "name": "paymentId",
                  "type": "string",
                  "required": true,
                  "description": "Unique payment identifier"
                },
                {
                  "name": "orderId",
                  "type": "string",
                  "required": true,
                  "description": "Associated order"
                },
                {
                  "name": "amount",
                  "type": "number",
                  "required": true,
                  "description": "Payment amount"
                },
                {
                  "name": "state",
                  "type": "PaymentState",
                  "required": true,
                  "description": "Current payment state"
                },
                {
                  "name": "transactionId",
                  "type": "string",
                  "required": false,
                  "description": "Payment gateway transaction ID"
                },
                {
                  "name": "authorizedAt",
                  "type": "DateTime",
                  "required": false,
                  "description": "When payment was authorized"
                },
                {
                  "name": "capturedAt",
                  "type": "DateTime",
                  "required": false,
                  "description": "When payment was captured"
                }
              ]
            }
          }
        }
      },